{
  "name": "transformers",
  "display_name": "Transformers",
  "categories": {
    "autobots": [
      "bumblebee", "cliffjumper", "elita-one", "grimlock", "hoist",
      "hound", "ironhide", "jazz", "jetfire", "mirage",
      "optimus", "perceptor", "prowl", "ratchet", "rodimus",
      "sideswipe", "silverbolt", "skyfire", "smokescreen", "springer",
      "sunstreaker", "trailbreaker", "ultra-magnus", "wheeljack", "windcharger"
    ],
    "decepticons": [
      "astrotrain", "barricade", "blitzwing", "bonecrusher", "breakdown",
      "cyclonus", "devastator", "dirge", "galvatron", "kickback",
      "laserbeak", "megatron", "mixmaster", "motormaster", "ramjet",
      "ravage", "rumble", "scavenger", "scorponok", "seekers",
      "shockwave", "skywarp", "soundwave", "starscream", "thundercracker",
      "trypticon"
    ],
    "combiners": [
      "abominus", "bruticus", "computron", "defensor", "devastator",
      "elita-infin1t", "liokaiser", "menasor", "piranacon",
      "predaking", "ruination", "superion", "volcanicus"
    ]
  },
  "default_category": "autobots"
}
