{
  "name": "nato",
  "display_name": "NATO",
  "categories": {
    "phonetic": [
      "alfa",
      "bravo",
      "charlie",
      "delta",
      "echo",
      "foxtrot",
      "golf",
      "hotel",
      "india",
      "juliet",
      "kilo",
      "lima",
      "mike",
      "november",
      "oscar",
      "papa",
      "quebec",
      "romeo",
      "sierra",
      "tango",
      "uniform",
      "victor",
      "whiskey",
      "xray",
      "yankee",
      "zulu"
    ],
    "operations": [
      "anvil",
      "avalanche",
      "barbarossa",
      "bayonet",
      "brimstone",
      "citadel",
      "crossbow",
      "dagger",
      "dragoon",
      "eagle",
      "falcon",
      "gladiator",
      "hammerfall",
      "husky",
      "ironclad",
      "kremlin",
      "mace",
      "neptune",
      "overlord",
      "pegasus",
      "quicksilver",
      "sabre",
      "tempest",
      "trident",
      "urgent-fury",
      "valkyrie",
      "warhammer",
      "anaconda",
      "atlas",
      "bandit",
      "bastion",
      "blizzard",
      "bulldog",
      "condor",
      "crusader",
      "demon",
      "eclipse",
      "ember",
      "firestorm",
      "fortress",
      "genesis",
      "griffin",
      "havoc",
      "inferno",
      "jaguar",
      "lightning",
      "mongoose",
      "musket",
      "nightfall",
      "ocelot",
      "paladin",
      "phantom",
      "python",
      "raven",
      "stalker",
      "stingray",
      "talon",
      "thunder",
      "titan",
      "vanguard",
      "venom",
      "vigilant",
      "vulcan",
      "wolfpack",
      "barracuda",
      "cardinal",
      "cyclone",
      "firebolt",
      "gryphon",
      "hammer",
      "ironside",
      "longbow",
      "mantis",
      "nighthawk",
      "panther",
      "rampart",
      "sandstorm",
      "siege",
      "stormfront",
      "torpedo",
      "uppercut",
      "viper",
      "warlock",
      "zenith"
    ],
    "ranks": [
      "admiral",
      "brigadier",
      "captain",
      "colonel",
      "commander",
      "commodore",
      "corporal",
      "ensign",
      "general",
      "lieutenant",
      "major",
      "marshal",
      "private",
      "sergeant",
      "warrant",
      "cadet",
      "centurion",
      "chief",
      "conscript",
      "deputy",
      "field-marshal",
      "gunner",
      "lancer",
      "midshipman",
      "officer",
      "petty-officer",
      "quartermaster",
      "ranger",
      "recruit",
      "sentinel",
      "specialist",
      "strategist",
      "subaltern",
      "trooper",
      "veteran"
    ],
    "equipment": [
      "abrams",
      "apache",
      "blackhawk",
      "bradley",
      "chinook",
      "cobra",
      "comanche",
      "f-16",
      "f-22",
      "f-35",
      "globemaster",
      "harrier",
      "hercules",
      "humvee",
      "kiowa",
      "lav",
      "leopard",
      "linebacker",
      "osprey",
      "patriot",
      "predator",
      "raptor",
      "reaper",
      "stinger",
      "stryker",
      "tomahawk",
      "tornado",
      "typhoon",
      "viper",
      "warthog",
      "abbot",
      "ajax",
      "archer",
      "boxer",
      "caesar",
      "challenger",
      "cougar",
      "foxhound",
      "grizzly",
      "guardian",
      "howitzer",
      "javelin",
      "leclerc",
      "mantis",
      "marder",
      "merkava",
      "mortar",
      "panther",
      "piranha",
      "puma",
      "scorpion",
      "scimitar",
      "spartan",
      "stormer",
      "warrior"
    ]
  },
  "default_category": "phonetic"
}
