{
  "name": "fallout",
  "display_name": "Fallout",
  "categories": {
    "creatures": [
      "angler",
      "assaultron",
      "behemoth",
      "bloatfly",
      "bloodbug",
      "brahmin",
      "cazador",
      "centaur",
      "crawling-torso",
      "crickets",
      "deathclaw",
      "eyebot",
      "feral-ghoul",
      "floater",
      "fog-crawler",
      "gatorclaw",
      "gecko",
      "ghoul",
      "grafton-monster",
      "gulper",
      "hermit-crab",
      "honeybeasts",
      "humanoid-robot",
      "liberator",
      "megasloth",
      "mirelurk",
      "mirelurk-queen",
      "mole-rat",
      "mongrel",
      "mothman",
      "mutant-hound",
      "nightstalker",
      "protectron",
      "radroach",
      "radscorpion",
      "radstag",
      "radtoad",
      "robobrain",
      "scorchbeast",
      "scorchbeast-queen",
      "sentry-bot",
      "sheepsquatch"
    ],
    "factions": [
      "atom-cats",
      "bos",
      "boomers",
      "caesars-legion",
      "children-of-atom",
      "brotherhood-outcasts",
      "crater-raiders",
      "disciples",
      "enclave",
      "fire-breathers",
      "followers",
      "foundation-settlers",
      "free-states",
      "great-khans",
      "gunners",
      "institute",
      "khans",
      "minutemen",
      "mister-house",
      "mothman-cultists",
      "ncr",
      "nuka-world-raiders",
      "operators",
      "pack",
      "powder-gangers",
      "railroad",
      "raiders",
      "regulators",
      "responders",
      "zetans",
      "talon-company",
      "the-kings",
      "tunnel-snakes",
      "vault-tec",
      "white-glove-society"
    ],
    "locations": [
      "acadia",
      "big-mt",
      "boston-common",
      "bunker-hill",
      "cambridge",
      "camp-mccarran",
      "camp-searchlight",
      "concord",
      "corvega",
      "diamond-city",
      "far-harbor",
      "fenway",
      "fort-hagen",
      "fort-independence",
      "freeside",
      "goodneighbor",
      "goodsprings",
      "grayditch",
      "helios-one",
      "hoover-dam",
      "jacobstown",
      "lexington",
      "lucky-38",
      "mariposa",
      "mass-fusion",
      "megaton",
      "necropolis",
      "nellis-afb",
      "new-vegas",
      "novac",
      "nuka-world",
      "oasis",
      "paradise-falls",
      "primm",
      "quincy",
      "red-rocket",
      "rivet-city",
      "salem",
      "sanctuary-hills",
      "shady-sands",
      "spectacle-island",
      "tenpenny-tower",
      "the-castle",
      "the-citadel",
      "the-commonwealth",
      "the-divide",
      "the-glowing-sea",
      "the-hub",
      "the-pitt",
      "the-strip"
    ],
    "weapons": [
      "10mm-pistol",
      "alien-blaster",
      "anti-materiel-rifle",
      "assault-rifle",
      "bb-gun",
      "big-boy",
      "broadsider",
      "bumper-sword",
      "chinese-assault",
      "combat-shotgun",
      "cryolator",
      "deliverer",
      "fatman",
      "fist-of-rawr",
      "flamer",
      "gamma-gun",
      "gauss-rifle",
      "gatling-laser",
      "hunting-rifle",
      "junk-jet",
      "kelloggs-pistol",
      "kremvhs-tooth",
      "laser-musket",
      "laser-rifle",
      "lincoln-repeater",
      "minigun",
      "mirv",
      "missile-launcher",
      "nuka-nuke",
      "overseer-guardian",
      "plasma-caster",
      "plasma-rifle",
      "power-fist",
      "radium-rifle",
      "railway-rifle",
      "ripper",
      "rock-it-launcher",
      "shishkebab",
      "sledgehammer",
      "spray-n-pray",
      "submachine-gun",
      "super-sledge"
    ],
    "characters": [
      "arcade-gannon",
      "boone",
      "butch",
      "cait",
      "cassidy",
      "charon",
      "codsworth",
      "curie",
      "danse",
      "deacon",
      "dogmeat",
      "ed-e",
      "elder-lyons",
      "elder-maxson",
      "fawkes",
      "hancock",
      "lily",
      "macready",
      "madison-li",
      "moira-brown",
      "mr-house",
      "nick-valentine",
      "piper",
      "preston",
      "raul",
      "rex",
      "strong",
      "three-dog",
      "ulysses",
      "veronica",
      "yes-man"
    ]
  },
  "default_category": "creatures"
}
