{
  "name": "eveonline",
  "display_name": "EVE Online",
  "categories": {
    "ships": [
      "abaddon",
      "absolution",
      "algos",
      "apocalypse",
      "arazu",
      "archon",
      "armageddon",
      "astero",
      "atron",
      "avatar",
      "badger",
      "bantam",
      "barghest",
      "basilisk",
      "bellicose",
      "bifrost",
      "blackbird",
      "broadsword",
      "brutix",
      "bustard",
      "caracal",
      "catalyst",
      "cerberus",
      "chimera",
      "claymore",
      "coercer",
      "condor",
      "confessor",
      "corax",
      "cormorant",
      "crane",
      "crow",
      "crucifier",
      "cyclone",
      "damnation",
      "damavik",
      "deimos",
      "devoter",
      "dominix",
      "drake",
      "dramiel",
      "eagle",
      "enyo",
      "erebus",
      "exequror",
      "ferox",
      "firetail",
      "flycatcher",
      "gnosis",
      "golem",
      "gila",
      "harbinger",
      "harpy",
      "hawk",
      "hecate",
      "hel",
      "heron",
      "hookbill",
      "huginn",
      "hurricane",
      "hyperion",
      "ibis",
      "impairor",
      "impel",
      "incursus",
      "ishkur",
      "ishtar",
      "jackdaw",
      "jaguar",
      "keres",
      "kestrel",
      "kikimora",
      "kronos",
      "lachesis",
      "legion",
      "leviathan",
      "loki",
      "machariel",
      "maelstrom",
      "magnate",
      "maller",
      "malediction",
      "manticore",
      "mastodon",
      "megathron",
      "merlin",
      "moa",
      "moros",
      "muninn",
      "myrmidon",
      "naga",
      "naglfar",
      "nemesis",
      "nidhoggur",
      "nightmare",
      "nyx",
      "omen",
      "oneiros"
    ],
    "factions": [
      "amarr",
      "caldari",
      "gallente",
      "minmatar",
      "angel-cartel",
      "blood-raiders",
      "concord",
      "guristas",
      "mordu",
      "ore",
      "sansha",
      "serpentis",
      "sisters-of-eve",
      "society-of-ct",
      "thukker",
      "triglavian",
      "edencom",
      "drifters",
      "jovian",
      "upwell",
      "intaki",
      "khanid",
      "ammatar",
      "interbus",
      "outer-ring-excavations",
      "wiyrkomi",
      "lai-dai",
      "ishukone",
      "kaalakiota",
      "hyasyoda"
    ],
    "regions": [
      "aridia",
      "black-rise",
      "branch",
      "cache",
      "catch",
      "cloud-ring",
      "cobalt-edge",
      "curse",
      "deklein",
      "delve",
      "detorid",
      "devoid",
      "domain",
      "esoteria",
      "essence",
      "etherium-reach",
      "fade",
      "feythabolis",
      "fountain",
      "geminate",
      "genesis",
      "great-wildlands",
      "heimatar",
      "immensea",
      "impass",
      "insmother",
      "lonetrek",
      "malpais",
      "metropolis",
      "molden-heath",
      "outer-passage",
      "outer-ring",
      "paragon-soul",
      "period-basis",
      "perrigen-falls",
      "placid",
      "providence",
      "pure-blind",
      "querious",
      "scalding-pass",
      "sinq-laison",
      "solitude",
      "stain",
      "syndicate",
      "tash-murkon",
      "tenal",
      "the-bleak-lands",
      "the-citadel"
    ],
    "systems": [
      "amamake",
      "asakai",
      "b-r5rb",
      "ec-p8r",
      "heydeles",
      "huola",
      "jita",
      "kamela",
      "m-oee8",
      "old-man-star",
      "poitot",
      "rancer",
      "tama",
      "thera",
      "uedama",
      "dodixie",
      "hek",
      "rens",
      "perimeter",
      "niarja",
      "ahbazon",
      "oulley",
      "misaba",
      "keberz"
    ]
  },
  "default_category": "ships"
}
