{
  "name": "pokemon",
  "display_name": "Pokémon",
  "categories": {
    "gen1": [
      "abra",
      "aerodactyl",
      "alakazam",
      "arcanine",
      "articuno",
      "blastoise",
      "bulbasaur",
      "chansey",
      "charizard",
      "charmander",
      "clefairy",
      "cubone",
      "dewgong",
      "diglett",
      "ditto",
      "dodrio",
      "dragonite",
      "drowzee",
      "dugtrio",
      "eevee",
      "electabuzz",
      "electrode",
      "exeggcute",
      "farfetchd",
      "fearow",
      "flareon",
      "gastly",
      "gengar",
      "geodude",
      "golduck",
      "golem",
      "graveler",
      "grimer",
      "growlithe",
      "gyarados",
      "haunter",
      "hitmonchan",
      "hitmonlee",
      "hypno",
      "ivysaur",
      "jigglypuff",
      "jolteon",
      "jynx",
      "kabuto",
      "kabutops",
      "kadabra",
      "kangaskhan",
      "kingler",
      "koffing",
      "lapras",
      "lickitung",
      "machamp",
      "machoke",
      "magikarp",
      "magmar",
      "magnemite",
      "magneton",
      "mankey",
      "marowak",
      "meowth",
      "mewtwo",
      "mew",
      "moltres",
      "mr-mime",
      "muk",
      "nidoking",
      "nidoqueen",
      "ninetales",
      "oddish",
      "omanyte",
      "onix",
      "parasect",
      "persian",
      "pidgeot",
      "pikachu",
      "pinsir",
      "poliwrath",
      "ponyta",
      "porygon",
      "primeape",
      "psyduck",
      "rapidash",
      "rhydon",
      "sandslash",
      "scyther"
    ],
    "legendaries": [
      "arceus",
      "azelf",
      "calyrex",
      "celebi",
      "cobalion",
      "cresselia",
      "darkrai",
      "deoxys",
      "dialga",
      "entei",
      "eternatus",
      "genesect",
      "giratina",
      "groudon",
      "heatran",
      "ho-oh",
      "jirachi",
      "keldeo",
      "koraidon",
      "kyogre",
      "kyurem",
      "landorus",
      "latias",
      "latios",
      "lugia",
      "lunala",
      "manaphy",
      "marshadow",
      "meloetta",
      "mesprit",
      "miraidon",
      "necrozma",
      "palkia",
      "raikou",
      "rayquaza",
      "regice",
      "regigigas",
      "regirock",
      "registeel",
      "reshiram",
      "shaymin",
      "solgaleo",
      "suicune",
      "terrakion",
      "thundurus",
      "tornadus",
      "uxie",
      "victini",
      "virizion",
      "volcanion",
      "xerneas",
      "yveltal",
      "zacian",
      "zamazenta",
      "zekrom",
      "zeroara",
      "zygarde"
    ],
    "types": [
      "bug",
      "dark",
      "dragon",
      "electric",
      "fairy",
      "fighting",
      "fire",
      "flying",
      "ghost",
      "grass",
      "ground",
      "ice",
      "normal",
      "poison",
      "psychic",
      "rock",
      "steel",
      "water"
    ],
    "regions": [
      "alola",
      "galar",
      "hoenn",
      "johto",
      "kalos",
      "kanto",
      "kitakami",
      "paldea",
      "sinnoh",
      "unova"
    ],
    "items": [
      "antidote",
      "dawn-stone",
      "dusk-ball",
      "escape-rope",
      "ether",
      "everstone",
      "exp-share",
      "fire-stone",
      "full-restore",
      "great-ball",
      "hyper-potion",
      "leaf-stone",
      "lemonade",
      "lucky-egg",
      "master-ball",
      "max-elixir",
      "max-revive",
      "moon-stone",
      "nugget",
      "poke-ball",
      "potion",
      "pp-up",
      "quick-ball",
      "rare-candy",
      "repel",
      "revive",
      "sacred-ash",
      "sun-stone",
      "thunder-stone",
      "timer-ball"
    ]
  },
  "default_category": "gen1"
}
