{
  "name": "leet",
  "display_name": "1337 Speak",
  "categories": {
    "handles": [
      "0day",
      "0v3rf10w",
      "1337",
      "b0t",
      "b4ckd00r",
      "b1n4ry",
      "bl4ckh4t",
      "c0d3r",
      "c0mpl13r",
      "cr4ck",
      "cr4ck3r",
      "crypt0",
      "cyb0rg",
      "d34dm4n",
      "d3bug",
      "d4rkl0rd",
      "d4rkn3t",
      "d4rkw3b",
      "fl00d",
      "gh0st",
      "gl1tch",
      "gr1ml0ck",
      "h4x0r",
      "k3rn3l",
      "l0g1c",
      "m4lw4r3",
      "m4tr1x",
      "m4v3r1ck",
      "n00b",
      "n3tw0rk",
      "n1ghtf0x",
      "n1tr0",
      "null",
      "p4ck3t",
      "p4yl04d",
      "ph34r",
      "ph4nt0m",
      "pr0c3ss",
      "pr0xy",
      "pwn4g3",
      "r00t",
      "r00tk1t",
      "r3b00t",
      "r3c0n",
      "s0ck3t",
      "sc4nn3r",
      "scr1pt",
      "sh3ll",
      "sk1llz",
      "sk1nn3r",
      "sn1ff3r",
      "sp00f",
      "sp4wn",
      "t3rm1n4l",
      "tr0j4n",
      "v1rus",
      "v3ct0r",
      "w0rm",
      "x0r",
      "z0mb13",
      "z3r0d4y",
      "b4ckf1r3",
      "c1ph3r",
      "d4t4",
      "f1r3w4ll",
      "h0n3yp0t"
    ],
    "actions": [
      "b4sh",
      "bl4st",
      "br34k",
      "br3wt",
      "buff3r",
      "buc3",
      "cr4ck-act",
      "cr4sh",
      "crypt",
      "d3c0d3",
      "d3l3t3",
      "d3str0y",
      "d3f4c3",
      "dump",
      "3nc0d3",
      "3scal8",
      "3x3c",
      "3xf1l",
      "3xpl01t",
      "fl4g",
      "fl4sh",
      "fr4g",
      "gr1nd",
      "h4ck",
      "h1j4ck",
      "1nj3ct",
      "j4ck",
      "k1ll",
      "l04d",
      "l0ck",
      "m0rph",
      "nuk3",
      "0bfusc8",
      "0wn",
      "p4rs3",
      "p4tch",
      "p1ng",
      "pwn",
      "r3kt",
      "r3v3rs3",
      "r3wr1t3",
      "s4n1t1z3",
      "sc4n",
      "sh1ft",
      "sn1ff",
      "spl01t",
      "sp4m",
      "sn1p3",
      "sp00f-act",
      "tr4c3"
    ],
    "ranks": [
      "0p",
      "4dm1n",
      "4rc4ng3l",
      "b0ss",
      "c4pt41n",
      "ch13f",
      "cr0wn",
      "d3m0n",
      "3l1t3",
      "g0d",
      "h1ghl4nd3r",
      "j3d1",
      "k1ng",
      "l34d",
      "l0rd",
      "m4st3r",
      "m4y0r",
      "n1nj4",
      "0v3rl0rd",
      "p4tr0n",
      "pr0",
      "r3g3nt",
      "r3p3r",
      "r00t-rank",
      "s4g3",
      "s3ntr1",
      "sh0gun",
      "sup3r",
      "t1t4n",
      "w1z4rd"
    ],
    "protocols": [
      "dn5",
      "ftp",
      "http",
      "https",
      "1cm9",
      "1rc",
      "k3rb3r0s",
      "ldap",
      "mqtt",
      "nfs",
      "nn7p",
      "ppp",
      "r4d1us",
      "rdp",
      "rsyn",
      "sm7p",
      "snmp",
      "ssh",
      "ssl",
      "t3ln3t",
      "tcp",
      "tls",
      "udp",
      "vnc",
      "vpn",
      "ws",
      "x11",
      "xmpp"
    ],
    "tools": [
      "burp",
      "c0b4lt",
      "d1rb",
      "h4shr4t",
      "h1dr4",
      "j0hn",
      "k4l1",
      "m3t4spl01t",
      "n1k70",
      "nm4p",
      "n3tc4t",
      "0w4sp",
      "p4ws",
      "r3sp0nd3r",
      "s3tl",
      "sn0rt",
      "sql1",
      "w1r3sh4rk",
      "z4p",
      "g0bust3r",
      "bl00dh0und",
      "4irp4ck",
      "ff0f",
      "b33f",
      "h4shc4t",
      "c4in"
    ]
  },
  "default_category": "handles"
}
