{
  "name": "warhammer-40k",
  "display_name": "Warhammer 40,000",
  "categories": {
    "chapters": [
      "alpha-legion",
      "black-legion",
      "black-templars",
      "blood-angels",
      "blood-ravens",
      "carcharodons",
      "crimson-fists",
      "dark-angels",
      "death-guard",
      "deathwatch",
      "emperor-children",
      "exorcists",
      "flesh-tearers",
      "grey-knights",
      "howling-griffons",
      "imperial-fists",
      "iron-hands",
      "iron-warriors",
      "lamenters",
      "minotaurs",
      "night-lords",
      "novamarines",
      "raptors",
      "raven-guard",
      "red-scorpions",
      "red-talons",
      "salamanders",
      "silver-skulls",
      "sons-of-medusa",
      "soul-drinkers",
      "space-wolves",
      "thousand-sons",
      "ultramarines",
      "white-scars",
      "word-bearers",
      "world-eaters"
    ],
    "units": [
      "assault-marine",
      "baneblade",
      "basilisk",
      "berzerker",
      "bladeguard",
      "carnifex",
      "centurion",
      "chaplain",
      "chimera",
      "crisis-suit",
      "custodes",
      "deathmark",
      "devastator",
      "dire-avenger",
      "dreadnought",
      "eradicator",
      "exarch",
      "falcon",
      "fire-dragon",
      "fire-warrior",
      "flayed-one",
      "genestealer",
      "ghost-ark",
      "guardian",
      "havoc",
      "hellblaster",
      "helldrake",
      "howling-banshee",
      "immortal",
      "incubus",
      "intercessor",
      "kabalite",
      "knight",
      "land-raider",
      "leman-russ",
      "librarian",
      "lychguard",
      "mandrake",
      "monolith",
      "necron-warrior",
      "obliterator",
      "pathfinder",
      "plague-marine",
      "predator",
      "primaris",
      "raider",
      "ravener",
      "razorback",
      "reiver",
      "repulsor",
      "rhino",
      "rubric-marine",
      "sentinel",
      "seraphim",
      "shadowseer",
      "sister-of-battle",
      "skorpekh",
      "stormraven",
      "striking-scorpion",
      "swooping-hawk",
      "techmarine",
      "terminator",
      "thunderhawk",
      "tomb-blade",
      "triarch-praetorian",
      "tyranid-warrior",
      "valkyrie",
      "vindicator",
      "warboss",
      "warp-spider"
    ],
    "primarchs": [
      "alpharius",
      "angron",
      "corvus-corax",
      "dorn",
      "ferrus-manus",
      "fulgrim",
      "guilliman",
      "horus",
      "jaghatai-khan",
      "konrad-curze",
      "leman-russ-primarch",
      "lion-el-jonson",
      "lorgar",
      "magnus",
      "mortarion",
      "omegon",
      "perturabo",
      "rogal-dorn",
      "roboute",
      "sanguinius",
      "vulkan"
    ],
    "gods": [
      "emperor",
      "khorne",
      "nurgle",
      "slaanesh",
      "tzeentch",
      "cegorach",
      "gork",
      "isha",
      "khaine",
      "mork",
      "ynnead"
    ],
    "weapons": [
      "autocannon",
      "boltgun",
      "boltstorm",
      "chainfist",
      "chainsword",
      "daemon-sword",
      "eviscerator",
      "flamestorm",
      "force-sword",
      "gauss-flayer",
      "graviton",
      "heavy-bolter",
      "heavy-flamer",
      "inferno-pistol",
      "krak-grenade",
      "lascannon",
      "melta-bomb",
      "meltagun",
      "multi-melta",
      "phase-sword",
      "plasma-cannon",
      "plasma-gun",
      "plasma-pistol",
      "power-axe",
      "power-claw",
      "power-fist",
      "power-sword",
      "reaper-cannon",
      "shuriken-cannon",
      "splinter-rifle",
      "storm-bolter",
      "storm-shield",
      "tesla-carbine",
      "thunder-hammer",
      "void-blade",
      "volkite",
      "warp-blade"
    ],
    "vehicles": [
      "goliath",
      "hammerhead",
      "hellhound",
      "immolator",
      "knight-castellan",
      "knight-errant",
      "land-speeder",
      "leman-russ-tank",
      "malcador",
      "manticore",
      "mastodon",
      "night-scythe",
      "piranha",
      "raider-vehicle",
      "reaver-titan",
      "repulsor-executioner",
      "shadowsword",
      "stormbird",
      "stormlord",
      "stormraven-gunship",
      "stormsurge",
      "thunderhawk-gunship",
      "titan-warlord",
      "valkyrie-airship",
      "warhound-titan"
    ]
  },
  "default_category": "chapters"
}
