{
  "name": "star-trek",
  "display_name": "Star Trek",
  "categories": {
    "ship_classes": [
      "akira",
      "ambassador",
      "california",
      "centaur",
      "cheyenne",
      "constellation",
      "constitution",
      "crossfield",
      "danube",
      "defiant",
      "dreadnought",
      "excelsior",
      "freedom",
      "galaxy",
      "hermes",
      "inquiry",
      "intrepid",
      "kelvin",
      "luna",
      "miranda",
      "nebula",
      "new-orleans",
      "niagara",
      "norway",
      "nova",
      "oberth",
      "odyssey",
      "olympic",
      "pathfinder",
      "prometheus",
      "ptolemy",
      "reliant",
      "saber",
      "sovereign",
      "springfield",
      "steamrunner",
      "sydney",
      "vesta",
      "walker"
    ],
    "species": [
      "andorian",
      "bajoran",
      "benzite",
      "betazoid",
      "bolian",
      "borg",
      "breen",
      "caitian",
      "cardassian",
      "changeling",
      "denobulan",
      "deltan",
      "edosian",
      "ferengi",
      "founders",
      "gorn",
      "hirogen",
      "horta",
      "jem-hadar",
      "kazon",
      "kelpien",
      "klingon",
      "lurian",
      "nausicaan",
      "orion",
      "pakled",
      "reman",
      "rigelian",
      "romulan",
      "saurian",
      "sheliak",
      "species-8472",
      "suliban",
      "talaxian",
      "tellarite",
      "tholian",
      "trill",
      "undine",
      "vidiian",
      "vorta",
      "vulcan",
      "xindi",
      "el-aurian",
      "bynars",
      "efrosian",
      "zakdorn",
      "acamarian",
      "arcadian",
      "argelian",
      "chalnoth",
      "dopterian",
      "elaysian"
    ],
    "characters": [
      "archer",
      "bashir",
      "beverly",
      "boimler",
      "burnham",
      "chakotay",
      "chapel",
      "chekov",
      "crusher",
      "dax",
      "data",
      "doctor",
      "dukat",
      "freeman",
      "garak",
      "geordi",
      "guinan",
      "hugh",
      "janeway",
      "kim",
      "kira",
      "kirk",
      "laforge",
      "lorca",
      "mariner",
      "mccoy",
      "neelix",
      "nhan",
      "number-one",
      "obrien",
      "odo",
      "paris",
      "picard",
      "pike",
      "phlox",
      "q",
      "quark",
      "reed",
      "riker",
      "ro-laren",
      "saru",
      "scotty",
      "seven",
      "shaxs",
      "sisko",
      "spock",
      "stamets",
      "sulu",
      "tendi",
      "tilly",
      "torres",
      "tpol",
      "troi",
      "tuvok",
      "uhura",
      "weyoun",
      "worf",
      "yar"
    ],
    "ships": [
      "aventine",
      "bozeman",
      "cerritos",
      "dauntless",
      "defiant-nx",
      "discovery",
      "enterprise",
      "enterprise-b",
      "enterprise-c",
      "enterprise-d",
      "enterprise-e",
      "excelsior-ncc",
      "farragut",
      "grissom",
      "hood",
      "lakota",
      "lexington",
      "melbourne",
      "pasteur",
      "phoenix",
      "protostar",
      "raven",
      "reliant-ncc",
      "rio-grande",
      "saratoga",
      "shenzhou",
      "stargazer",
      "titan",
      "valiant",
      "vengeance",
      "voyager",
      "yeager",
      "zheng-he"
    ],
    "locations": [
      "bajor",
      "cardassia",
      "deep-space-nine",
      "earth",
      "earth-spacedock",
      "ferenginar",
      "memory-alpha",
      "nimbus-iii",
      "qonos",
      "remus",
      "risa",
      "romulus",
      "rura-penthe",
      "sha-ka-ree",
      "starbase-1",
      "talos-iv",
      "utopia-planitia",
      "wolf-359"
    ]
  },
  "default_category": "ship_classes"
}
