{
  "name": "gundam",
  "display_name": "Mobile Suit Gundam",
  "categories": {
    "mobile_suits": [
      "acguy", "barbatos", "deathscythe", "dom", "dynames",
      "epyon", "exia", "freedom", "gelgoog", "gouf",
      "guncannon", "guntank", "heavyarms", "hygogg", "jesta",
      "kampfer", "kshatriya", "kyrios", "marasai", "nu-gundam",
      "qubeley", "rx-78", "sazabi", "sinanju", "strike",
      "tallgeese", "turn-a", "unicorn", "virtue", "wing",
      "zaku", "zeong", "zgok", "zeta", "astray",
      "bael", "banshee", "crossbone", "duel", "flauros",
      "grimgerde", "gusion", "lupus-rex", "phenex", "vidar"
    ],
    "characters": [
      "amuro", "athrun", "bright", "char", "dozle",
      "domon", "garma", "gihren", "haman", "hayato",
      "heero", "judau", "kai", "kamille", "kira",
      "lacus", "lalah", "lockon", "mikazuki", "mu",
      "orga", "quattro", "ramba-ral", "scirocco", "setsuna",
      "shinn", "tieria", "trowa", "wufei", "zechs"
    ],
    "ships": [
      "albion", "argama", "archangel", "dominion", "dogosse-giar",
      "gwazine", "irish", "la-vie-en-rose", "minerva", "musai",
      "nahel-argama", "ptolemaios", "radish", "rewloola",
      "salamis", "white-base", "zanzibar"
    ]
  },
  "default_category": "mobile_suits"
}
